{
  "version": "scintilla.module-projections/v1",
  "generator": {
    "repository": "ORESoftware/api-docs",
    "rust_api": "render_module_interface",
    "runtime_profile": "scintilla",
    "generated_files_read_only": true,
    "commit": "c02712957850046e339b1e94d8d41b219feb304c"
  },
  "rules": {
    "prefer_native_module_contract": true,
    "fallback_export_value_must_be_typed": true,
    "projection_must_preserve_invocation_semantics": true,
    "projection_does_not_define_transport_schema": true
  },
  "languages": [
    {"id":"rust","strategy":"trait_impl","enforcement":"compile_time","source":"langs/rust"},
    {"id":"typescript","strategy":"satisfies_export_object","enforcement":"compile_time","source":"langs/typescript"},
    {"id":"dart","strategy":"abstract_interface_or_typed_export","enforcement":"compile_time","source":"langs/dart"},
    {"id":"gleam","strategy":"opaque_typed_export","enforcement":"compile_time","source":"langs/gleam"},
    {"id":"erlang","strategy":"behaviour_callbacks","enforcement":"compiler_plus_static_analysis","example":"module-projections/erlang/example_module.erl"},
    {"id":"sml","strategy":"signature_structure","enforcement":"compile_time","example":"module-projections/sml/scintilla_module.sml"},
    {"id":"ocaml","strategy":"module_type","enforcement":"compile_time","example":"module-projections/ocaml/scintilla_module.ml"},
    {"id":"racket","strategy":"provide_contract","enforcement":"runtime_boundary","example":"module-projections/racket/scintilla_module.rkt"},
    {"id":"ada","strategy":"package_spec","enforcement":"compile_time","example":"module-projections/ada/scintilla_module.ads"},
    {"id":"modula2","strategy":"definition_module","enforcement":"compile_time","example":"module-projections/modula2/ScintillaModule.def"},
    {"id":"modula3","strategy":"interface_module","enforcement":"compile_time","example":"module-projections/modula3/ScintillaModule.i3"},
    {"id":"haskell","strategy":"backpack_signature","enforcement":"compile_time","example":"module-projections/haskell/ScintillaModule.hsig"},
    {"id":"wit","strategy":"component_interface","enforcement":"component_link_time","source":"wit/scintilla.wit"}
  ]
}
